{
  "as_of_date": "2026-08-31",
  "asset_class_weights": [
    { "asset_class": "Equity", "weight": 0.476 },
    { "asset_class": "Fund", "weight": 0.3712 },
    { "asset_class": "Cash", "weight": 0.1219 },
    { "asset_class": "Other", "weight": 0.0181 },
    { "asset_class": "Repo", "weight": 0.0128 }
  ],
  "classification_notes": [
    "Asset classes use the Capital official NAV allocation; repo and other assets remain explicit residual buckets.",
    "SITCA's 2026/08 monthly top-ten disclosure confirms the weights and adds ISIN identifiers; it is not a complete look-through GICS or country distribution.",
    "SITCA's 2026/06 quarterly disclosure lists positions at or above 1% NAV (74.75% coverage); the remaining 25.25% is retained as unclassified."
  ],
  "isin": "TW000T1668D4",
  "issuer": "Capital Investment Trust",
  "kind": "fund",
  "listings": [
    { "currency": "TWD", "symbol": "73709234D" }
  ],
  "name": "群益潛力收益多重資產基金NB(月配型-新臺幣)",
  "primary_symbol": "73709234D",
  "provenance": {
    "fetched_at": "2026-09-16T12:17:52Z",
    "license": "Issuer/platform terms; rights not assumed",
    "source": "Capital official NAV allocation / MoneyDJ FundDJ",
    "source_url": "https://www.capitalfund.com.tw/fund/detail/180/hold"
  },
  "schema_version": "1.0.0",
  "top_holdings": [
    { "isin": "US4642885135", "name": "iShares安碩iBoxx美元高收益公司債ETF", "weight": 0.112 },
    { "isin": "US78462F1030", "name": "State Street SPDR標普500指數股票ETF", "weight": 0.0858 },
    { "isin": "US4642872422", "name": "iShares iBoxx美元投資級公司債ETF", "weight": 0.0722 },
    { "isin": "US0378331005", "name": "蘋果公司", "weight": 0.042 },
    { "symbol": "2330", "name": "台積電", "weight": 0.0341 },
    { "isin": "US24703L2025", "name": "戴爾科技公司", "weight": 0.023 },
    { "isin": "US78464A3591", "name": "State Street SPDR彭博可轉換證券ETF", "weight": 0.0218 },
    { "isin": "US67066G1040", "name": "輝達公司", "weight": 0.0211 },
    { "isin": "US78464A8707", "name": "State Street SPDR標普生技指數股票ETF", "weight": 0.02 },
    { "isin": "ES0113900J37", "name": "西班牙國際銀行", "weight": 0.0191 }
  ]
}
